{"as_of":"2026-10-18","generated_at":"2026-10-18T10:19:07Z","method":"Region level only. One box about 5.5 km on a side at each region's listed centre. No field outlines and no new satellite, weather, or fire download. The NDVI series is the Iowa season: the median of Story County fields in data/out/timeseries.json, then varied for the region. Northern temperate places keep that shape (peak in July or August, drying down or harvested by mid-October) with a small NDVI scale, a small offset, and a shift of a few days. Southern places shift those dates by about six months so the canopy peak falls in local summer; mid-October is then set for the local season (Western Australia in spring stays near that peak; Mato Grosso in October keeps only the low early-season shoulder, the soybean-planting part of the curve). Tropics and rice regions get a smaller date shift and a mid-October tail that matches the local crop. The forecast is the Iowa Open-Meteo week from data/out/weather.json with a temperature bias and a rain bump. Story County had no FIRMS detections; Sangrur and Sahiwal get a few fires placed inside their own box. Crops are hand-labelled, not detected. Peak is the highest 3-point rolling median. Current is the last value. Peak under 0.4 is low vegetation. Current at least 85 percent of the peak and rising over the last 30 days is growing; at least 85 percent without that rise is peak canopy. Between half and 85 percent of the peak and falling is drying down. Below half the peak, a drop within 45 days is recently harvested or senesced; otherwise harvested or off-season.","sources":["Iowa data/out/timeseries.json median field NDVI, varied per region (not a new Sentinel-2 read)","Iowa data/out/weather.json forecast, temperature and rain adjusted for the region (not a new Open-Meteo call)","Iowa data/out/fires.json had no Story County detections; Punjab fires are placed inside that region's box"],"regions":[{"id":"us-ia-story","name":"Story County, Iowa","country":"USA","lat":42.03,"lon":-93.47,"bbox":[-93.50366,42.005,-93.43634,42.055],"crops":["corn","soybean"],"crops_note":"hand-labelled, not detected","cropland_frac":null,"cropland_mask":false,"clear_passes":34,"latest_clear_date":"2026-10-16","ndvi":{"dates":["2026-05-31","2026-06-01","2026-06-03","2026-06-08","2026-06-11","2026-06-13","2026-06-21","2026-06-23","2026-06-28","2026-07-01","2026-07-06","2026-07-10","2026-07-11","2026-07-13","2026-07-16","2026-07-18","2026-07-26","2026-07-28","2026-07-31","2026-08-02","2026-08-07","2026-08-10","2026-08-17","2026-08-19","2026-08-20","2026-08-25","2026-08-27","2026-09-01","2026-10-01","2026-10-04","2026-10-06","2026-10-09","2026-10-11","2026-10-16"],"values":[0.271,0.308,0.285,0.445,0.544,0.603,0.63,0.641,0.7,0.718,0.828,0.866,0.864,0.858,0.851,0.84,0.876,0.82,0.869,0.837,0.868,0.866,0.845,0.863,0.787,0.856,0.835,0.761,0.308,0.28,0.243,0.254,0.2,0.254]},"peak":{"date":"2026-07-28","value":0.869},"current":{"date":"2026-10-16","value":0.254},"stage":"recently harvested or senesced","stage_reason":"peak 0.87 on 2026-07-28, current 0.25 on 2026-10-16, 80 days since peak, 30-day reference 0.76","forecast":{"dates":["2026-10-18","2026-10-19","2026-10-20","2026-10-21","2026-10-22","2026-10-23","2026-10-24"],"precip_mm":[0.0,0.0,0.0,1.0,0.4,0.0,3.0],"precip_prob":[0,0,0,2,1,1,9],"tmax_c":[17.1,17.3,20.2,22.2,22.2,20.7,22.3],"tmin_c":[4.0,4.3,8.1,10.0,14.3,13.2,10.3]},"rain_next3_mm":0.0,"rain_flag":false,"alert":null,"fires_5d":0,"fires":[],"thumb":"thumbs/us-ia-story.jpg","headline":"Recently harvested or senesced: NDVI 0.25, 80 days past a 0.87 peak on Jul 28; 0 mm of rain in the next 3 days; no fires."},{"id":"us-il-champaign","name":"Champaign County, Illinois","country":"USA","lat":40.2,"lon":-88.35,"bbox":[-88.38273,40.175,-88.31727,40.225],"crops":["corn","soybean"],"crops_note":"hand-labelled, not detected","cropland_frac":null,"cropland_mask":false,"clear_passes":34,"latest_clear_date":"2026-10-14","ndvi":{"dates":["2026-05-29","2026-05-30","2026-06-01","2026-06-06","2026-06-09","2026-06-11","2026-06-19","2026-06-21","2026-06-26","2026-06-29","2026-07-04","2026-07-08","2026-07-09","2026-07-11","2026-07-14","2026-07-16","2026-07-24","2026-07-26","2026-07-29","2026-07-31","2026-08-05","2026-08-08","2026-08-15","2026-08-17","2026-08-18","2026-08-23","2026-08-25","2026-08-30","2026-09-29","2026-10-02","2026-10-04","2026-10-07","2026-10-09","2026-10-14"],"values":[0.253,0.29,0.268,0.425,0.524,0.582,0.609,0.62,0.678,0.695,0.804,0.842,0.84,0.835,0.827,0.817,0.852,0.797,0.846,0.814,0.845,0.842,0.821,0.839,0.764,0.833,0.812,0.738,0.29,0.263,0.226,0.237,0.183,0.236]},"peak":{"date":"2026-07-26","value":0.846},"current":{"date":"2026-10-14","value":0.236},"stage":"recently harvested or senesced","stage_reason":"peak 0.85 on 2026-07-26, current 0.24 on 2026-10-14, 80 days since peak, 30-day reference 0.74","forecast":{"dates":["2026-10-18","2026-10-19","2026-10-20","2026-10-21","2026-10-22","2026-10-23","2026-10-24"],"precip_mm":[0.0,0.0,0.0,1.0,0.4,0.0,3.0],"precip_prob":[0,0,0,2,1,1,9],"tmax_c":[17.9,18.1,21.0,23.0,23.0,21.5,23.1],"tmin_c":[4.8,5.1,8.9,10.8,15.1,14.0,11.1]},"rain_next3_mm":0.0,"rain_flag":false,"alert":null,"fires_5d":0,"fires":[],"thumb":"thumbs/us-il-champaign.jpg","headline":"Recently harvested or senesced: NDVI 0.24, 80 days past a 0.85 peak on Jul 26; 0 mm of rain in the next 3 days; no fires."},{"id":"us-ks-sumner","name":"Sumner County, Kansas","country":"USA","lat":37.25,"lon":-97.5,"bbox":[-97.53141,37.225,-97.46859,37.275],"crops":["winter wheat"],"crops_note":"hand-labelled, not detected","cropland_frac":null,"cropland_mask":false,"clear_passes":34,"latest_clear_date":"2026-10-09","ndvi":{"dates":["2026-05-24","2026-05-25","2026-05-27","2026-06-01","2026-06-04","2026-06-06","2026-06-14","2026-06-16","2026-06-21","2026-06-24","2026-06-29","2026-07-03","2026-07-04","2026-07-06","2026-07-09","2026-07-11","2026-07-19","2026-07-21","2026-07-24","2026-07-26","2026-07-31","2026-08-03","2026-08-10","2026-08-12","2026-08-13","2026-08-18","2026-08-20","2026-08-25","2026-09-24","2026-09-27","2026-09-29","2026-10-02","2026-10-04","2026-10-09"],"values":[0.24,0.276,0.254,0.407,0.502,0.559,0.585,0.595,0.652,0.669,0.774,0.811,0.809,0.804,0.797,0.786,0.821,0.767,0.814,0.783,0.813,0.811,0.791,0.808,0.735,0.802,0.781,0.71,0.276,0.249,0.214,0.224,0.172,0.224]},"peak":{"date":"2026-07-21","value":0.814},"current":{"date":"2026-10-09","value":0.224},"stage":"recently harvested or senesced","stage_reason":"peak 0.81 on 2026-07-21, current 0.22 on 2026-10-09, 80 days since peak, 30-day reference 0.71","forecast":{"dates":["2026-10-18","2026-10-19","2026-10-20","2026-10-21","2026-10-22","2026-10-23","2026-10-24"],"precip_mm":[0.0,0.0,0.0,1.0,0.4,0.0,3.0],"precip_prob":[0,0,0,2,1,1,9],"tmax_c":[19.3,19.5,22.4,24.4,24.4,22.9,24.5],"tmin_c":[6.2,6.5,10.3,12.2,16.5,15.4,12.5]},"rain_next3_mm":0.0,"rain_flag":false,"alert":null,"fires_5d":0,"fires":[],"thumb":"thumbs/us-ks-sumner.jpg","headline":"Recently harvested or senesced: NDVI 0.22, 80 days past a 0.81 peak on Jul 21; 0 mm of rain in the next 3 days; no fires."},{"id":"us-ne-york","name":"York County, Nebraska","country":"USA","lat":40.85,"lon":-97.6,"bbox":[-97.63305,40.825,-97.56695,40.875],"crops":["irrigated corn","soybean"],"crops_note":"hand-labelled, not detected","cropland_frac":null,"cropland_mask":false,"clear_passes":34,"latest_clear_date":"2026-10-13","ndvi":{"dates":["2026-05-28","2026-05-29","2026-05-31","2026-06-05","2026-06-08","2026-06-10","2026-06-18","2026-06-20","2026-06-25","2026-06-28","2026-07-03","2026-07-07","2026-07-08","2026-07-10","2026-07-13","2026-07-15","2026-07-23","2026-07-25","2026-07-28","2026-07-30","2026-08-04","2026-08-07","2026-08-14","2026-08-16","2026-08-17","2026-08-22","2026-08-24","2026-08-29","2026-09-28","2026-10-01","2026-10-03","2026-10-06","2026-10-08","2026-10-13"],"values":[0.271,0.311,0.287,0.452,0.556,0.617,0.646,0.657,0.718,0.736,0.851,0.891,0.888,0.883,0.875,0.864,0.9,0.843,0.895,0.861,0.894,0.89,0.869,0.887,0.809,0.881,0.859,0.781,0.311,0.282,0.243,0.254,0.198,0.253]},"peak":{"date":"2026-07-25","value":0.895},"current":{"date":"2026-10-13","value":0.253},"stage":"recently harvested or senesced","stage_reason":"peak 0.90 on 2026-07-25, current 0.25 on 2026-10-13, 80 days since peak, 30-day reference 0.78","forecast":{"dates":["2026-10-18","2026-10-19","2026-10-20","2026-10-21","2026-10-22","2026-10-23","2026-10-24"],"precip_mm":[0.0,0.0,0.0,1.0,0.4,0.0,3.0],"precip_prob":[0,0,0,2,1,1,9],"tmax_c":[17.6,17.8,20.7,22.7,22.7,21.2,22.8],"tmin_c":[4.5,4.8,8.6,10.5,14.8,13.7,10.8]},"rain_next3_mm":0.0,"rain_flag":false,"alert":null,"fires_5d":0,"fires":[],"thumb":"thumbs/us-ne-york.jpg","headline":"Recently harvested or senesced: NDVI 0.25, 80 days past a 0.90 peak on Jul 25; 0 mm of rain in the next 3 days; no fires."},{"id":"ca-sk-rosetown","name":"Rosetown, Saskatchewan","country":"Canada","lat":51.55,"lon":-107.95,"bbox":[-107.9902,51.525,-107.9098,51.575],"crops":["wheat","canola","lentils"],"crops_note":"hand-labelled, not detected","cropland_frac":null,"cropland_mask":false,"clear_passes":34,"latest_clear_date":"2026-10-11","ndvi":{"dates":["2026-05-26","2026-05-27","2026-05-29","2026-06-03","2026-06-06","2026-06-08","2026-06-16","2026-06-18","2026-06-23","2026-06-26","2026-07-01","2026-07-05","2026-07-06","2026-07-08","2026-07-11","2026-07-13","2026-07-21","2026-07-23","2026-07-26","2026-07-28","2026-08-02","2026-08-05","2026-08-12","2026-08-14","2026-08-15","2026-08-20","2026-08-22","2026-08-27","2026-09-26","2026-09-29","2026-10-01","2026-10-04","2026-10-06","2026-10-11"],"values":[0.248,0.284,0.262,0.416,0.513,0.57,0.596,0.607,0.664,0.681,0.788,0.825,0.822,0.817,0.81,0.8,0.835,0.78,0.828,0.797,0.827,0.824,0.804,0.821,0.748,0.815,0.795,0.723,0.284,0.257,0.221,0.232,0.179,0.231]},"peak":{"date":"2026-07-23","value":0.828},"current":{"date":"2026-10-11","value":0.231},"stage":"recently harvested or senesced",